{
  "$schema": "./schema/feature.schema.json",
  "id": "essensys-temporary-password-2026-09-040",
  "title": "Mot de passe temporaire administrateur et changement imposé — backend",
  "status": "proposed",
  "owner": "hermes",
  "jira": {
    "issue": "TBD",
    "test_plan": null
  },
  "git": {
    "branch": "feat/essensys-temporary-password-2026-09-040",
    "pr_url": null
  },
  "openspec": {
    "change_id": "essensys-temporary-password-2026-09-040",
    "path": "../essensys-memory/openspec/changes/essensys-temporary-password-2026-09-040",
    "proposal": "../essensys-memory/openspec/changes/essensys-temporary-password-2026-09-040/proposal.md",
    "design": "../essensys-memory/openspec/changes/essensys-temporary-password-2026-09-040/design.md",
    "tasks": "../essensys-memory/openspec/changes/essensys-temporary-password-2026-09-040/tasks.md",
    "specs": [
      "../essensys-memory/openspec/changes/essensys-temporary-password-2026-09-040/specs/admin-temporary-password-issue/spec.md",
      "../essensys-memory/openspec/changes/essensys-temporary-password-2026-09-040/specs/password-change-enforcement/spec.md",
      "../essensys-memory/openspec/changes/essensys-temporary-password-2026-09-040/specs/temporary-password-notification/spec.md"
    ]
  },
  "implementation": {
    "paths": [
      "migrations/014_temporary_password.sql",
      "internal/temppass/temppass.go",
      "internal/admin/temporary_password.go",
      "internal/admin/routes.go",
      "internal/identity/password_change.go",
      "internal/identity/routes.go",
      "internal/identity/handlers.go",
      "internal/middleware/user_status.go",
      "internal/domain/user.go",
      "internal/domain/auth.go",
      "internal/domain/email.go",
      "internal/data/user_store.go"
    ],
    "primary_surface": "api"
  },
  "userguide": {
    "pages": [
      "docs/features/temporary-password.md"
    ],
    "language": "fr",
    "i18n_keys": [],
    "screenshots": []
  },
  "tests": {
    "playwright": [],
    "coverage_must_test": [
      "émission refusée à un appelant sans rôle administrateur global (403)",
      "émission refusée sur un compte inexistant (404)",
      "émission refusée sur un compte interdit (409 account_forbidden)",
      "émission pose les trois colonnes et renvoie un mot de passe conforme à la politique",
      "mot de passe généré exempt de O, 0, I, l, 1 et d'au moins 12 caractères",
      "émission invalide les jetons de réinitialisation en cours",
      "mot de passe en clair absent du journal d'audit et des journaux applicatifs",
      "échec d'envoi de courriel renvoie 200 email_sent=false sans annuler l'émission",
      "compte marqué reçoit 409 password_change_required sur profil, portail et administration",
      "rôle administrateur ne confère aucune exemption au verrou",
      "interdiction de compte prime sur le changement requis (403 account_forbidden)",
      "route de changement de mot de passe accessible malgré le verrou",
      "session ouverte avant l'émission reçoit 409 à la requête suivante",
      "connexion avec mot de passe temporaire valide renvoie password_change_required",
      "connexion avec mot de passe temporaire expiré renvoie 401 temporary_password_expired",
      "mot de passe erroné sur compte à temporaire expiré ne révèle pas l'état du compte",
      "changement refusé si mot de passe actuel erroné (401)",
      "changement refusé si nouveau mot de passe sous 8 caractères (400)",
      "changement refusé si nouveau mot de passe identique à l'actuel (400)",
      "changement réussi efface les trois colonnes et rouvre l'accès avec le jeton existant",
      "audit TEMPORARY_PASSWORD_ISSUED et PASSWORD_CHANGED_AFTER_TEMPORARY produits"
    ],
    "smoke_tags": [
      "@auth",
      "@admin"
    ]
  },
  "confluence": {
    "space": "ESSENSYS",
    "parent_page": "0",
    "template": "feature",
    "draft_page_id": null,
    "published_page_id": null
  },
  "release": {
    "changelog_entry": "Mot de passe temporaire émis par un administrateur, avec changement imposé à la première connexion",
    "target_tag": null,
    "surfaces": [
      "essensys-user-portal-backend"
    ],
    "paths": [
      "migrations/014_temporary_password.sql",
      "internal/admin/temporary_password.go",
      "internal/identity/password_change.go",
      "internal/middleware/user_status.go",
      "internal/temppass/temppass.go"
    ]
  },
  "security": {
    "sca_tool": "dependabot",
    "dependabot_alerts_url": null,
    "last_scan_at": null,
    "cve_findings": {
      "critical": 0,
      "high": 0,
      "medium": 0,
      "low": 0
    },
    "secret_scan": {
      "status": "clean",
      "tool": "gitleaks",
      "last_scan_at": null
    },
    "muted_findings": [],
    "threat_model_url": "../essensys-memory/openspec/changes/essensys-temporary-password-2026-09-040/design.md",
    "owner_security": "hermes"
  }
}
