{
  "$schema": "./schema/feature.schema.json",
  "id": "essensys-temporary-password-hardening-2026-09-041",
  "title": "Durcissement post-revue du mot de passe temporaire — backend",
  "status": "proposed",
  "owner": "hermes",
  "jira": {
    "issue": "TBD",
    "test_plan": null
  },
  "git": {
    "branch": "feat/essensys-temporary-password-hardening-2026-09-041",
    "pr_url": null
  },
  "openspec": {
    "change_id": "essensys-temporary-password-hardening-2026-09-041",
    "path": "../essensys-memory/openspec/changes/essensys-temporary-password-hardening-2026-09-041",
    "proposal": "../essensys-memory/openspec/changes/essensys-temporary-password-hardening-2026-09-041/proposal.md",
    "design": "../essensys-memory/openspec/changes/essensys-temporary-password-hardening-2026-09-041/design.md",
    "tasks": "../essensys-memory/openspec/changes/essensys-temporary-password-hardening-2026-09-041/tasks.md",
    "specs": [
      "../essensys-memory/openspec/changes/essensys-temporary-password-hardening-2026-09-041/specs/admin-temporary-password-issue/spec.md"
    ]
  },
  "implementation": {
    "paths": [
      ".gitleaks.toml",
      "internal/identity/routes.go"
    ],
    "primary_surface": "api"
  },
  "userguide": {
    "pages": [
      "docs/features/temporary-password.md"
    ],
    "language": "fr",
    "i18n_keys": [],
    "screenshots": []
  },
  "tests": {
    "playwright": [],
    "coverage_must_test": [
      "les trois limiteurs de débit répondent 429 au-delà du plafond avec le message d'origine",
      "limitation du changement de mot de passe par adresse IP et non par compte"
    ],
    "smoke_tags": [
      "@auth",
      "@security"
    ]
  },
  "confluence": {
    "space": "ESSENSYS",
    "parent_page": "0",
    "template": "feature",
    "draft_page_id": null,
    "published_page_id": null
  },
  "release": {
    "changelog_entry": "Allowlist gitleaks restreinte aux littéraux de test connus ; limiteurs de débit dédupliqués",
    "target_tag": null,
    "surfaces": [
      "essensys-user-portal-backend"
    ],
    "paths": [
      ".gitleaks.toml",
      "internal/identity/routes.go"
    ]
  },
  "security": {
    "sca_tool": "dependabot",
    "dependabot_alerts_url": null,
    "last_scan_at": null,
    "cve_findings": {
      "critical": 0,
      "high": 0,
      "medium": 0,
      "low": 0
    },
    "secret_scan": {
      "status": "clean",
      "tool": "gitleaks",
      "last_scan_at": null
    },
    "muted_findings": [],
    "threat_model_url": "../essensys-memory/openspec/changes/essensys-temporary-password-hardening-2026-09-041/design.md",
    "owner_security": "hermes"
  }
}
